{
  "schema": "terrain_pack.v1",
  "packId": "terrain-pack-ashwood",
  "version": "1.0.0",
  "producer": {
    "tool": "AssetGenerator",
    "version": "0.2.0",
    "generatedAt": "2026-02-20T10:00:00.000Z"
  },
  "meta": {
    "description": "Terrain pack for the Ashwood Forest zone in Emberfall",
    "author": "seedframe-team"
  },
  "materials": ["dirt", "grass", "water"],
  "colorMap": {
    "dirt": "#8B6914",
    "grass": "#4A7C2E",
    "water": "#2E5FA1"
  },
  "transitions": [
    {
      "id": "dirt-grass-ms01",
      "boundary": ["dirt", "grass"],
      "model": "marching-squares",
      "case": 8,
      "cornerBits": "0001",
      "tileId": "dirt_grass_ms0001",
      "transform": "none"
    },
    {
      "id": "dirt-grass-ms02",
      "boundary": ["dirt", "grass"],
      "model": "marching-squares",
      "case": 6,
      "cornerBits": "0110",
      "tileId": "dirt_grass_ms0110",
      "transform": "none"
    },
    {
      "id": "dirt-water-ms01",
      "boundary": ["dirt", "water"],
      "model": "marching-squares",
      "case": 8,
      "cornerBits": "0001",
      "tileId": "dirt_water_ms0001",
      "transform": "none"
    },
    {
      "id": "grass-water-ms01",
      "boundary": ["grass", "water"],
      "model": "marching-squares",
      "case": 6,
      "cornerBits": "0110",
      "tileId": "grass_water_ms0110",
      "transform": "none",
      "renderOrder": 0
    },
    {
      "id": "grass-water-ms01-outline",
      "boundary": ["grass", "water"],
      "model": "marching-squares",
      "case": 6,
      "cornerBits": "0110",
      "tileId": "grass_water_ms0110_outline",
      "transform": "none",
      "renderOrder": 10,
      "layerTag": "outline"
    }
  ],
  "variants": [
    { "tileId": "grass_base", "material": "grass", "weight": 1.0 },
    { "tileId": "grass_v1", "material": "grass", "weight": 0.3 },
    { "tileId": "dirt_base", "material": "dirt", "weight": 1.0 },
    { "tileId": "dirt_v1", "material": "dirt", "weight": 0.2 },
    { "tileId": "water_base", "material": "water", "weight": 1.0 }
  ]
}
